{
  "file": "xlsx_no_theme.xlsx",
  "format": "xlsx",
  "source": "Existing Office regression fixture",
  "features": {
    "text": {
      "paragraph_count": 0,
      "total_words": 0
    }
  },
  "structure_only": true,
  "structure": {
    "containers": [
      {
        "kind": "sheet",
        "name": "Fills"
      }
    ],
    "table_cells": [
      {
        "table": 0,
        "scope": "Fills",
        "row": 1,
        "col": 1,
        "text": "Case"
      },
      {
        "table": 0,
        "scope": "Fills",
        "row": 1,
        "col": 2,
        "text": "Value"
      },
      {
        "table": 0,
        "scope": "Fills",
        "row": 2,
        "col": 1,
        "text": "rgb solid"
      },
      {
        "table": 0,
        "scope": "Fills",
        "row": 2,
        "col": 2,
        "text": "yes",
        "fill": "#ffff00"
      },
      {
        "table": 0,
        "scope": "Fills",
        "row": 3,
        "col": 1,
        "text": "theme accent1 +40%"
      },
      {
        "table": 0,
        "scope": "Fills",
        "row": 3,
        "col": 2,
        "text": "t"
      },
      {
        "table": 0,
        "scope": "Fills",
        "row": 4,
        "col": 1,
        "text": "theme accent1 -25%"
      },
      {
        "table": 0,
        "scope": "Fills",
        "row": 4,
        "col": 2,
        "text": "t"
      },
      {
        "table": 0,
        "scope": "Fills",
        "row": 5,
        "col": 1,
        "text": "theme 2 (lt2)"
      },
      {
        "table": 0,
        "scope": "Fills",
        "row": 5,
        "col": 2,
        "text": "t"
      },
      {
        "table": 0,
        "scope": "Fills",
        "row": 6,
        "col": 1,
        "text": "theme 3 (dk2)"
      },
      {
        "table": 0,
        "scope": "Fills",
        "row": 6,
        "col": 2,
        "text": "t"
      },
      {
        "table": 0,
        "scope": "Fills",
        "row": 7,
        "col": 1,
        "text": "indexed 22"
      },
      {
        "table": 0,
        "scope": "Fills",
        "row": 7,
        "col": 2,
        "text": "i"
      },
      {
        "table": 0,
        "scope": "Fills",
        "row": 8,
        "col": 1,
        "text": "font colour"
      },
      {
        "table": 0,
        "scope": "Fills",
        "row": 8,
        "col": 2,
        "text": "red text",
        "color": "#ff0000"
      },
      {
        "table": 0,
        "scope": "Fills",
        "row": 9,
        "col": 1,
        "text": "font theme accent2"
      },
      {
        "table": 0,
        "scope": "Fills",
        "row": 9,
        "col": 2,
        "text": "t"
      },
      {
        "table": 0,
        "scope": "Fills",
        "row": 10,
        "col": 1,
        "text": "font explicit default"
      },
      {
        "table": 0,
        "scope": "Fills",
        "row": 10,
        "col": 2,
        "text": "t"
      },
      {
        "table": 0,
        "scope": "Fills",
        "row": 11,
        "col": 1,
        "text": "pattern darkGray"
      },
      {
        "table": 0,
        "scope": "Fills",
        "row": 11,
        "col": 2,
        "text": "p",
        "fill": "#00b050"
      },
      {
        "table": 0,
        "scope": "Fills",
        "row": 12,
        "col": 1,
        "text": "gradient"
      },
      {
        "table": 0,
        "scope": "Fills",
        "row": 12,
        "col": 2,
        "text": "g"
      },
      {
        "table": 0,
        "scope": "Fills",
        "row": 13,
        "col": 1,
        "text": "empty styled"
      },
      {
        "table": 0,
        "scope": "Fills",
        "row": 13,
        "col": 2,
        "text": "",
        "fill": "#ffc000"
      },
      {
        "table": 0,
        "scope": "Fills",
        "row": 14,
        "col": 1,
        "text": "no fill"
      },
      {
        "table": 0,
        "scope": "Fills",
        "row": 14,
        "col": 2,
        "text": "plain"
      }
    ]
  },
  "verification": {
    "method": "Office XML assertions; independent of parser output",
    "oracle": "build_structure_truth.py v2",
    "source_sha256": "e3ff2da0d8cb85890cc2508a3fb2c9d2632fc2cccd504c03f1153fd083563428"
  },
  "benchmark_version": "2.0.0"
}
