{
  "file": "xlsx_condfmt.xlsx",
  "format": "xlsx",
  "source": "Existing Office regression fixture",
  "features": {
    "text": {
      "paragraph_count": 0,
      "total_words": 0
    }
  },
  "structure_only": true,
  "structure": {
    "containers": [
      {
        "kind": "sheet",
        "name": "Status"
      }
    ],
    "table_cells": [
      {
        "table": 0,
        "scope": "Status",
        "row": 1,
        "col": 1,
        "text": "Item"
      },
      {
        "table": 0,
        "scope": "Status",
        "row": 1,
        "col": 2,
        "text": "Amount"
      },
      {
        "table": 0,
        "scope": "Status",
        "row": 1,
        "col": 3,
        "text": "Score"
      },
      {
        "table": 0,
        "scope": "Status",
        "row": 2,
        "col": 1,
        "text": "Item 1"
      },
      {
        "table": 0,
        "scope": "Status",
        "row": 2,
        "col": 2,
        "text": "50"
      },
      {
        "table": 0,
        "scope": "Status",
        "row": 2,
        "col": 3,
        "text": "1"
      },
      {
        "table": 0,
        "scope": "Status",
        "row": 3,
        "col": 1,
        "text": "Item 2"
      },
      {
        "table": 0,
        "scope": "Status",
        "row": 3,
        "col": 2,
        "text": "150"
      },
      {
        "table": 0,
        "scope": "Status",
        "row": 3,
        "col": 3,
        "text": "5"
      },
      {
        "table": 0,
        "scope": "Status",
        "row": 4,
        "col": 1,
        "text": "Item 3"
      },
      {
        "table": 0,
        "scope": "Status",
        "row": 4,
        "col": 2,
        "text": "90"
      },
      {
        "table": 0,
        "scope": "Status",
        "row": 4,
        "col": 3,
        "text": "3"
      },
      {
        "table": 0,
        "scope": "Status",
        "row": 5,
        "col": 1,
        "text": "Item 4"
      },
      {
        "table": 0,
        "scope": "Status",
        "row": 5,
        "col": 2,
        "text": "300"
      },
      {
        "table": 0,
        "scope": "Status",
        "row": 5,
        "col": 3,
        "text": "9"
      },
      {
        "table": 0,
        "scope": "Status",
        "row": 6,
        "col": 1,
        "text": "Item 5"
      },
      {
        "table": 0,
        "scope": "Status",
        "row": 6,
        "col": 2,
        "text": "10"
      },
      {
        "table": 0,
        "scope": "Status",
        "row": 6,
        "col": 3,
        "text": "2"
      }
    ]
  },
  "verification": {
    "method": "Office XML assertions; independent of parser output",
    "oracle": "build_structure_truth.py v2",
    "source_sha256": "2086dfab15134e18db8d5f4cdbbdb8ea93bc9b69db2d5c6291391016a2e5d990"
  },
  "benchmark_version": "2.0.0"
}
