{
  "file": "inline_formatting.docx",
  "format": "docx",
  "source": "Existing Office regression fixture",
  "features": {
    "text": {
      "paragraph_count": 0,
      "total_words": 0
    }
  },
  "structure_only": true,
  "structure": {
    "runs": [
      {
        "text": "bold",
        "bold": true
      },
      {
        "text": "italic",
        "italic": true
      },
      {
        "text": "underline",
        "underline": true
      },
      {
        "text": "strike",
        "strike": true
      },
      {
        "text": "2",
        "vertAlign": "superscript"
      },
      {
        "text": "2",
        "vertAlign": "subscript"
      },
      {
        "text": "explicitly not bold",
        "bold": false
      }
    ],
    "breaks": [
      {
        "kind": "section-break"
      }
    ]
  },
  "verification": {
    "method": "Office XML assertions; independent of parser output",
    "oracle": "build_structure_truth.py v2",
    "source_sha256": "aaaa269a7021e57001aff1cff8c5ca7b05acd580809e50227b3266796e9a36ab"
  },
  "benchmark_version": "2.0.0"
}
