{
  "file": "challenge_number_formats.xlsx",
  "format": "xlsx",
  "source": "Existing Office regression fixture",
  "features": {
    "text": {
      "paragraph_count": 0,
      "total_words": 0
    }
  },
  "structure_only": true,
  "structure": {
    "containers": [
      {
        "kind": "sheet",
        "name": "Formats"
      }
    ],
    "table_cells": [
      {
        "table": 0,
        "scope": "Formats",
        "row": 1,
        "col": 1,
        "text": "Type"
      },
      {
        "table": 0,
        "scope": "Formats",
        "row": 1,
        "col": 2,
        "text": "Value"
      },
      {
        "table": 0,
        "scope": "Formats",
        "row": 1,
        "col": 3,
        "text": "Expected Display"
      },
      {
        "table": 0,
        "scope": "Formats",
        "row": 2,
        "col": 1,
        "text": "Date"
      },
      {
        "table": 0,
        "scope": "Formats",
        "row": 2,
        "col": 3,
        "text": "2026-03-15"
      },
      {
        "table": 0,
        "scope": "Formats",
        "row": 3,
        "col": 1,
        "text": "Percent"
      },
      {
        "table": 0,
        "scope": "Formats",
        "row": 3,
        "col": 3,
        "text": "85.6%"
      },
      {
        "table": 0,
        "scope": "Formats",
        "row": 4,
        "col": 1,
        "text": "Currency"
      },
      {
        "table": 0,
        "scope": "Formats",
        "row": 4,
        "col": 3,
        "text": "$1,234.56"
      },
      {
        "table": 0,
        "scope": "Formats",
        "row": 5,
        "col": 1,
        "text": "Plain Number"
      },
      {
        "table": 0,
        "scope": "Formats",
        "row": 5,
        "col": 2,
        "text": "42"
      },
      {
        "table": 0,
        "scope": "Formats",
        "row": 5,
        "col": 3,
        "text": "42"
      },
      {
        "table": 0,
        "scope": "Formats",
        "row": 6,
        "col": 1,
        "text": "Date 2"
      },
      {
        "table": 0,
        "scope": "Formats",
        "row": 6,
        "col": 3,
        "text": "2025-12-25"
      }
    ]
  },
  "verification": {
    "method": "Office XML assertions; independent of parser output",
    "oracle": "build_structure_truth.py v2",
    "source_sha256": "f031d6f0fdcba1353cb91f1f9a8de00c94cb7d080ed8c7bfbe61ee20ae738290"
  },
  "benchmark_version": "2.0.0"
}
