{
  "file": "pptx_slide_order_notes.pptx",
  "format": "pptx",
  "source": "Existing Office regression fixture",
  "features": {
    "text": {
      "paragraph_count": 0,
      "total_words": 0
    }
  },
  "structure_only": true,
  "structure": {
    "containers": [
      {
        "kind": "slide",
        "name": "Kickoff"
      },
      {
        "kind": "slide",
        "name": "Agenda"
      },
      {
        "kind": "slide",
        "name": "Market"
      },
      {
        "kind": "slide",
        "name": "Pricing"
      },
      {
        "kind": "slide",
        "name": "Roadmap"
      },
      {
        "kind": "slide",
        "name": ""
      },
      {
        "kind": "slide",
        "name": "Team"
      },
      {
        "kind": "slide",
        "name": "Risks"
      },
      {
        "kind": "slide",
        "name": "Budget"
      },
      {
        "kind": "slide",
        "name": "Metrics"
      },
      {
        "kind": "slide",
        "name": "Timeline"
      },
      {
        "kind": "slide",
        "name": "Asks"
      },
      {
        "kind": "slide",
        "name": "Close"
      }
    ],
    "notes": [
      {
        "scope": "Kickoff",
        "text": "Open with the customer quote"
      },
      {
        "scope": "Agenda",
        "text": "Keep this under a minute"
      },
      {
        "scope": "Market",
        "text": "Segment two is the growth story"
      },
      {
        "scope": "Roadmap",
        "text": "Line one of the roadmap notes Line two of the roadmap notes"
      },
      {
        "scope": "",
        "text": "This slide is intentionally blank; pause here"
      },
      {
        "scope": "Team",
        "text": "Introduce the new hires"
      },
      {
        "scope": "Risks",
        "text": "Be candid about hiring risk"
      },
      {
        "scope": "Budget",
        "text": "Budget is draft as of 29/09/2026"
      },
      {
        "scope": "Metrics",
        "text": "Tie each metric to a decision"
      },
      {
        "scope": "Timeline",
        "text": "Milestone three moved a week"
      },
      {
        "scope": "Asks",
        "text": "Make the ask explicit"
      },
      {
        "scope": "Close",
        "text": "Take questions for ten minutes"
      }
    ]
  },
  "verification": {
    "method": "Office XML assertions; independent of parser output",
    "oracle": "build_structure_truth.py v2",
    "source_sha256": "ff43ea0d0743e823e5b34321564ed68ce48267d4d43e494cbb957e1dd4753636"
  },
  "benchmark_version": "2.0.0"
}
