{
  "file": "python_pptx_slides.pptx",
  "format": "pptx",
  "source": "python-pptx (MIT)",
  "verified": false,
  "features": {
    "text": {
      "paragraph_count": 0,
      "total_words": 0,
      "key_phrases": []
    },
    "headings": {
      "present": false,
      "count": 0,
      "by_level": {}
    },
    "tables": {
      "present": false,
      "count": 0,
      "total_rows": 0,
      "has_merged_cells": false
    },
    "track_changes": null,
    "comments": null,
    "headers_footers": null,
    "footnotes_endnotes": null,
    "speaker_notes": {
      "present": false,
      "count": 0
    },
    "text_boxes": {
      "present": false,
      "count": 0
    },
    "images": {
      "present": false,
      "count": 0
    },
    "lists": {
      "present": false,
      "count": 0
    },
    "metadata": {
      "title": "Presentation",
      "author": "python-pptx",
      "created": "2012-11-17T11:07:40Z",
      "modified": "2016-05-27T01:03:50Z"
    },
    "sheets": null
  },
  "full_text_words": [],
  "structure": {
    "containers": [
      {
        "kind": "slide",
        "name": ""
      },
      {
        "kind": "slide",
        "name": ""
      },
      {
        "kind": "slide",
        "name": ""
      }
    ]
  },
  "verification": {
    "method": "Office XML assertions; independent of parser output",
    "oracle": "build_structure_truth.py v2",
    "source_sha256": "7742ae6663ec5a12b85e0f987ae05b47cf0cb72b7ab303d0c05770aef1276004"
  },
  "benchmark_version": "2.0.0"
}
