{
  "file": "challenge_formula_cached.xlsx",
  "format": "xlsx",
  "source": "Existing Office regression fixture",
  "features": {
    "text": {
      "paragraph_count": 0,
      "total_words": 0
    }
  },
  "structure_only": true,
  "structure": {
    "containers": [
      {
        "kind": "sheet",
        "name": "Formulas"
      }
    ],
    "table_cells": [
      {
        "table": 0,
        "scope": "Formulas",
        "row": 1,
        "col": 1,
        "text": "Item"
      },
      {
        "table": 0,
        "scope": "Formulas",
        "row": 1,
        "col": 2,
        "text": "Q1"
      },
      {
        "table": 0,
        "scope": "Formulas",
        "row": 1,
        "col": 3,
        "text": "Q2"
      },
      {
        "table": 0,
        "scope": "Formulas",
        "row": 1,
        "col": 4,
        "text": "Total"
      },
      {
        "table": 0,
        "scope": "Formulas",
        "row": 1,
        "col": 5,
        "text": "Average"
      },
      {
        "table": 0,
        "scope": "Formulas",
        "row": 2,
        "col": 1,
        "text": "Revenue"
      },
      {
        "table": 0,
        "scope": "Formulas",
        "row": 2,
        "col": 2,
        "text": "50000"
      },
      {
        "table": 0,
        "scope": "Formulas",
        "row": 2,
        "col": 3,
        "text": "62000"
      },
      {
        "table": 0,
        "scope": "Formulas",
        "row": 2,
        "col": 4,
        "formula": "B2+C2"
      },
      {
        "table": 0,
        "scope": "Formulas",
        "row": 2,
        "col": 5,
        "formula": "D2/2"
      },
      {
        "table": 0,
        "scope": "Formulas",
        "row": 3,
        "col": 1,
        "text": "Costs"
      },
      {
        "table": 0,
        "scope": "Formulas",
        "row": 3,
        "col": 2,
        "text": "30000"
      },
      {
        "table": 0,
        "scope": "Formulas",
        "row": 3,
        "col": 3,
        "text": "35000"
      },
      {
        "table": 0,
        "scope": "Formulas",
        "row": 3,
        "col": 4,
        "formula": "B3+C3"
      },
      {
        "table": 0,
        "scope": "Formulas",
        "row": 3,
        "col": 5,
        "formula": "D3/2"
      },
      {
        "table": 0,
        "scope": "Formulas",
        "row": 4,
        "col": 1,
        "text": "Profit"
      },
      {
        "table": 0,
        "scope": "Formulas",
        "row": 4,
        "col": 2,
        "formula": "B2-B3"
      },
      {
        "table": 0,
        "scope": "Formulas",
        "row": 4,
        "col": 3,
        "formula": "C2-C3"
      },
      {
        "table": 0,
        "scope": "Formulas",
        "row": 4,
        "col": 4,
        "formula": "B4+C4"
      },
      {
        "table": 0,
        "scope": "Formulas",
        "row": 4,
        "col": 5,
        "formula": "D4/2"
      },
      {
        "table": 0,
        "scope": "Formulas",
        "row": 6,
        "col": 1,
        "text": "Total Revenue"
      },
      {
        "table": 0,
        "scope": "Formulas",
        "row": 6,
        "col": 2,
        "formula": "SUM(B2:C2)"
      },
      {
        "table": 0,
        "scope": "Formulas",
        "row": 7,
        "col": 1,
        "text": "Total Costs"
      },
      {
        "table": 0,
        "scope": "Formulas",
        "row": 7,
        "col": 2,
        "formula": "SUM(B3:C3)"
      },
      {
        "table": 0,
        "scope": "Formulas",
        "row": 8,
        "col": 1,
        "text": "Net Profit"
      },
      {
        "table": 0,
        "scope": "Formulas",
        "row": 8,
        "col": 2,
        "formula": "B6-B7"
      }
    ]
  },
  "verification": {
    "method": "Office XML assertions; independent of parser output",
    "oracle": "build_structure_truth.py v2",
    "source_sha256": "a533f63709e87686ce53d4ee8f9a5dc6b7ba544178939d09b23648de485c8533"
  },
  "benchmark_version": "2.0.0"
}
