{
  "file": "challenge_comment_google_sdt.docx",
  "format": "docx",
  "source": "Existing Office regression fixture",
  "features": {
    "text": {
      "paragraph_count": 0,
      "total_words": 0
    }
  },
  "structure_only": true,
  "structure": {
    "comment_anchors": [
      {
        "text": "THIS IS ON CHARLIE",
        "author": "Tester",
        "annotated_text": "Charlie 30",
        "anchored": true
      }
    ],
    "table_cells": [
      {
        "table": 0,
        "row": 1,
        "col": 1,
        "text": "1",
        "col_span": 1,
        "merged": false
      },
      {
        "table": 0,
        "row": 1,
        "col": 2,
        "text": "Alpha",
        "col_span": 1,
        "merged": false
      },
      {
        "table": 0,
        "row": 1,
        "col": 3,
        "text": "10",
        "col_span": 1,
        "merged": false
      },
      {
        "table": 0,
        "row": 2,
        "col": 1,
        "text": "2",
        "col_span": 1,
        "merged": false
      },
      {
        "table": 0,
        "row": 2,
        "col": 2,
        "text": "Bravo",
        "col_span": 1,
        "merged": false
      },
      {
        "table": 0,
        "row": 2,
        "col": 3,
        "text": "20",
        "col_span": 1,
        "merged": false
      },
      {
        "table": 0,
        "row": 3,
        "col": 1,
        "text": "3",
        "col_span": 1,
        "merged": false
      },
      {
        "table": 0,
        "row": 3,
        "col": 2,
        "text": "Charlie",
        "col_span": 1,
        "merged": false
      },
      {
        "table": 0,
        "row": 3,
        "col": 3,
        "text": "30",
        "col_span": 1,
        "merged": false
      },
      {
        "table": 0,
        "row": 4,
        "col": 1,
        "text": "4",
        "col_span": 1,
        "merged": false
      },
      {
        "table": 0,
        "row": 4,
        "col": 2,
        "text": "Delta",
        "col_span": 1,
        "merged": false
      },
      {
        "table": 0,
        "row": 4,
        "col": 3,
        "text": "40",
        "col_span": 1,
        "merged": false
      },
      {
        "table": 0,
        "row": 5,
        "col": 1,
        "text": "5",
        "col_span": 1,
        "merged": false
      },
      {
        "table": 0,
        "row": 5,
        "col": 2,
        "text": "Echo",
        "col_span": 1,
        "merged": false
      },
      {
        "table": 0,
        "row": 5,
        "col": 3,
        "text": "50",
        "col_span": 1,
        "merged": false
      }
    ]
  },
  "verification": {
    "method": "Office XML assertions; independent of parser output",
    "oracle": "build_structure_truth.py v2",
    "source_sha256": "f461291181ee6fde9e3de0a4eac42b528cb0014bce7c0adf2a7da02c23abda60"
  },
  "benchmark_version": "2.0.0"
}
