{
  "file": "challenge_comment_table.docx",
  "format": "docx",
  "source": "Existing Office regression fixture",
  "features": {
    "text": {
      "paragraph_count": 0,
      "total_words": 0
    }
  },
  "structure_only": true,
  "structure": {
    "comment_anchors": [
      {
        "text": "These two tranches together exceed the approved budget.",
        "author": "Laura",
        "annotated_text": "EUR 250,000 Acceptance EUR 750,000",
        "anchored": true
      },
      {
        "text": "Retention should be 10 percent.",
        "author": "Miguel",
        "annotated_text": "EUR 100,000",
        "anchored": true
      }
    ],
    "table_cells": [
      {
        "table": 0,
        "row": 1,
        "col": 1,
        "text": "Milestone",
        "col_span": 1,
        "merged": false
      },
      {
        "table": 0,
        "row": 1,
        "col": 2,
        "text": "Amount",
        "col_span": 1,
        "merged": false
      },
      {
        "table": 0,
        "row": 2,
        "col": 1,
        "text": "Delivery",
        "col_span": 1,
        "merged": false
      },
      {
        "table": 0,
        "row": 2,
        "col": 2,
        "text": "EUR 250,000",
        "col_span": 1,
        "merged": false
      },
      {
        "table": 0,
        "row": 3,
        "col": 1,
        "text": "Acceptance",
        "col_span": 1,
        "merged": false
      },
      {
        "table": 0,
        "row": 3,
        "col": 2,
        "text": "EUR 750,000",
        "col_span": 1,
        "merged": false
      },
      {
        "table": 0,
        "row": 4,
        "col": 1,
        "text": "Retention",
        "col_span": 1,
        "merged": false
      },
      {
        "table": 0,
        "row": 4,
        "col": 2,
        "text": "EUR 100,000",
        "col_span": 1,
        "merged": false
      }
    ]
  },
  "verification": {
    "method": "Office XML assertions; independent of parser output",
    "oracle": "build_structure_truth.py v2",
    "source_sha256": "5655331116c1dbe73ea2c316c320de0b038da443d56b467bed1b6fd57122abb1"
  },
  "benchmark_version": "2.0.0"
}
