{
  "file": "challenge_comment_orphans.docx",
  "format": "docx",
  "source": "Existing Office regression fixture",
  "features": {
    "text": {
      "paragraph_count": 0,
      "total_words": 0
    }
  },
  "structure_only": true,
  "structure": {
    "comment_anchors": [
      {
        "text": "Check this termination date.",
        "author": "Laura",
        "annotated_text": "terminates on 30 June",
        "anchored": true
      },
      {
        "text": "Body with no anchor anywhere in the document.",
        "author": "Miguel",
        "annotated_text": "",
        "anchored": false
      },
      {
        "text": "Point anchor only.",
        "author": "Laura",
        "annotated_text": "A paragraph carrying only a point anchor.",
        "anchored": true
      },
      {
        "text": "Range was never closed.",
        "author": "Miguel",
        "annotated_text": "",
        "anchored": false
      }
    ],
    "bookmarks": [
      {
        "name": "decoy"
      }
    ]
  },
  "verification": {
    "method": "Office XML assertions; independent of parser output",
    "oracle": "build_structure_truth.py v2",
    "source_sha256": "cba92b2d58b495b6c4274affe715cefc0031db6264ebc545156345db64dab177"
  },
  "benchmark_version": "2.0.0"
}
