{
  "file": "challenge_pptx_formatting.pptx",
  "format": "pptx",
  "source": "Existing Office regression fixture",
  "features": {
    "text": {
      "paragraph_count": 0,
      "total_words": 0
    }
  },
  "structure_only": true,
  "structure": {
    "containers": [
      {
        "kind": "slide",
        "name": "Formatted Text in Slides"
      },
      {
        "kind": "slide",
        "name": "Key Terminology"
      }
    ],
    "runs": [
      {
        "text": "bold text",
        "bold": true
      },
      {
        "text": "italic text",
        "italic": true
      },
      {
        "text": "bold italic",
        "bold": true,
        "italic": true
      },
      {
        "text": "API manifest",
        "bold": true
      },
      {
        "text": "machine-readable",
        "italic": true
      }
    ]
  },
  "verification": {
    "method": "Office XML assertions; independent of parser output",
    "oracle": "build_structure_truth.py v2",
    "source_sha256": "3f4b98474763692619f0443ad1a5b260422b342b7eeb0d09abccdb81e5ae7d10"
  },
  "benchmark_version": "2.0.0"
}
