{
  "file": "challenge_comments.xlsx",
  "format": "xlsx",
  "source": "Existing Office regression fixture",
  "features": {
    "text": {
      "paragraph_count": 0,
      "total_words": 0
    }
  },
  "structure_only": true,
  "structure": {
    "containers": [
      {
        "kind": "sheet",
        "name": "Data"
      }
    ],
    "table_cells": [
      {
        "table": 0,
        "scope": "Data",
        "row": 1,
        "col": 1,
        "text": "Revenue"
      },
      {
        "table": 0,
        "scope": "Data",
        "row": 1,
        "col": 2,
        "text": "50000"
      },
      {
        "table": 0,
        "scope": "Data",
        "row": 2,
        "col": 1,
        "text": "Expenses"
      },
      {
        "table": 0,
        "scope": "Data",
        "row": 2,
        "col": 2,
        "text": "35000"
      }
    ],
    "comment_anchors": [
      {
        "text": "This is Q1 revenue",
        "author": "Finance Team",
        "annotated_text": "A1: Revenue",
        "anchored": true,
        "scope": "Data"
      },
      {
        "text": "Exceeds target by 10 percent",
        "author": "Manager",
        "annotated_text": "B1: 50000",
        "anchored": true,
        "scope": "Data"
      },
      {
        "text": "Under budget",
        "author": "Finance Team",
        "annotated_text": "B2: 35000",
        "anchored": true,
        "scope": "Data"
      }
    ]
  },
  "verification": {
    "method": "Office XML assertions; independent of parser output",
    "oracle": "build_structure_truth.py v2",
    "source_sha256": "080f2da10a00db8f9e4cd25c26286875236109f200655da90a3f2ec3d651782b"
  },
  "benchmark_version": "2.0.0"
}
