{
  "file": "challenge_sparse_rows.xlsx",
  "format": "xlsx",
  "source": "Existing Office regression fixture",
  "features": {
    "text": {
      "paragraph_count": 0,
      "total_words": 0
    }
  },
  "structure_only": true,
  "structure": {
    "containers": [
      {
        "kind": "sheet",
        "name": "Leads"
      },
      {
        "kind": "sheet",
        "name": "Summary"
      },
      {
        "kind": "sheet",
        "name": "Gaps"
      },
      {
        "kind": "sheet",
        "name": "Tab 02"
      },
      {
        "kind": "sheet",
        "name": "Tab 04"
      },
      {
        "kind": "sheet",
        "name": "Tab 05"
      },
      {
        "kind": "sheet",
        "name": "Tab 06"
      },
      {
        "kind": "sheet",
        "name": "Tab 07"
      },
      {
        "kind": "sheet",
        "name": "Tab 08"
      },
      {
        "kind": "sheet",
        "name": "Tab 09"
      },
      {
        "kind": "sheet",
        "name": "Tab 10"
      },
      {
        "kind": "sheet",
        "name": "Tab 11"
      }
    ],
    "table_cells": [
      {
        "table": 0,
        "scope": "Leads",
        "row": 1,
        "col": 1,
        "text": "First name"
      },
      {
        "table": 0,
        "scope": "Leads",
        "row": 1,
        "col": 2,
        "text": "Title"
      },
      {
        "table": 0,
        "scope": "Leads",
        "row": 1,
        "col": 3,
        "text": "Company"
      },
      {
        "table": 0,
        "scope": "Leads",
        "row": 1,
        "col": 4,
        "text": "Website"
      },
      {
        "table": 0,
        "scope": "Leads",
        "row": 1,
        "col": 5,
        "text": "Contact"
      },
      {
        "table": 0,
        "scope": "Leads",
        "row": 1,
        "col": 6,
        "text": "Role"
      },
      {
        "table": 0,
        "scope": "Leads",
        "row": 1,
        "col": 7,
        "text": "Phone"
      },
      {
        "table": 0,
        "scope": "Leads",
        "row": 1,
        "col": 8,
        "text": "Source"
      },
      {
        "table": 0,
        "scope": "Leads",
        "row": 1,
        "col": 9,
        "text": "Status"
      },
      {
        "table": 0,
        "scope": "Leads",
        "row": 1,
        "col": 10,
        "text": "Owner"
      },
      {
        "table": 0,
        "scope": "Leads",
        "row": 1,
        "col": 11,
        "text": "Notes"
      },
      {
        "table": 0,
        "scope": "Leads",
        "row": 2,
        "col": 1,
        "text": "Jordan"
      },
      {
        "table": 0,
        "scope": "Leads",
        "row": 2,
        "col": 3,
        "text": "ExampleCo"
      },
      {
        "table": 0,
        "scope": "Leads",
        "row": 2,
        "col": 4,
        "text": "example-co.example"
      },
      {
        "table": 0,
        "scope": "Leads",
        "row": 2,
        "col": 5,
        "text": "Sam Placeholder"
      },
      {
        "table": 0,
        "scope": "Leads",
        "row": 2,
        "col": 6,
        "text": "CEO"
      },
      {
        "table": 0,
        "scope": "Leads",
        "row": 2,
        "col": 8,
        "text": "Intro call, 3 July 2026"
      },
      {
        "table": 0,
        "scope": "Leads",
        "row": 3,
        "col": 3,
        "text": "Northwind"
      },
      {
        "table": 0,
        "scope": "Leads",
        "row": 3,
        "col": 7,
        "text": "5551234"
      },
      {
        "table": 0,
        "scope": "Leads",
        "row": 3,
        "col": 11,
        "text": "no owner yet"
      },
      {
        "table": 0,
        "scope": "Leads",
        "row": 4,
        "col": 1,
        "text": "Ada"
      },
      {
        "table": 0,
        "scope": "Leads",
        "row": 4,
        "col": 2,
        "text": "Dr"
      },
      {
        "table": 0,
        "scope": "Leads",
        "row": 4,
        "col": 3,
        "text": "Analytical"
      },
      {
        "table": 0,
        "scope": "Leads",
        "row": 4,
        "col": 4,
        "text": "analytical.org"
      },
      {
        "table": 0,
        "scope": "Leads",
        "row": 4,
        "col": 5,
        "text": "Ada L"
      },
      {
        "table": 0,
        "scope": "Leads",
        "row": 4,
        "col": 6,
        "text": "CTO"
      },
      {
        "table": 0,
        "scope": "Leads",
        "row": 4,
        "col": 7,
        "text": "5550000"
      },
      {
        "table": 0,
        "scope": "Leads",
        "row": 4,
        "col": 8,
        "text": "Referral"
      },
      {
        "table": 0,
        "scope": "Leads",
        "row": 4,
        "col": 9,
        "text": "Won"
      },
      {
        "table": 0,
        "scope": "Leads",
        "row": 4,
        "col": 10,
        "text": "Mark"
      },
      {
        "table": 0,
        "scope": "Leads",
        "row": 4,
        "col": 11,
        "text": "signed"
      },
      {
        "table": 1,
        "scope": "Summary",
        "row": 1,
        "col": 1,
        "text": "Metric"
      },
      {
        "table": 1,
        "scope": "Summary",
        "row": 1,
        "col": 2,
        "text": "Value"
      },
      {
        "table": 1,
        "scope": "Summary",
        "row": 2,
        "col": 1,
        "text": "Leads"
      },
      {
        "table": 1,
        "scope": "Summary",
        "row": 2,
        "col": 3,
        "text": "see Leads"
      },
      {
        "table": 2,
        "scope": "Gaps",
        "row": 1,
        "col": 1,
        "text": "Row"
      },
      {
        "table": 2,
        "scope": "Gaps",
        "row": 1,
        "col": 2,
        "text": "Value"
      },
      {
        "table": 2,
        "scope": "Gaps",
        "row": 2,
        "col": 1,
        "text": "r2"
      },
      {
        "table": 2,
        "scope": "Gaps",
        "row": 2,
        "col": 2,
        "text": "2"
      },
      {
        "table": 2,
        "scope": "Gaps",
        "row": 5,
        "col": 1,
        "text": "r5"
      },
      {
        "table": 2,
        "scope": "Gaps",
        "row": 5,
        "col": 2,
        "text": "5"
      },
      {
        "table": 2,
        "scope": "Gaps",
        "row": 6,
        "col": 1,
        "text": "r6"
      },
      {
        "table": 2,
        "scope": "Gaps",
        "row": 6,
        "col": 2,
        "text": "6"
      },
      {
        "table": 3,
        "scope": "Tab 02",
        "row": 1,
        "col": 1,
        "text": "Sheet part"
      },
      {
        "table": 3,
        "scope": "Tab 02",
        "row": 1,
        "col": 2,
        "text": "2"
      },
      {
        "table": 4,
        "scope": "Tab 04",
        "row": 1,
        "col": 1,
        "text": "Sheet part"
      },
      {
        "table": 4,
        "scope": "Tab 04",
        "row": 1,
        "col": 2,
        "text": "4"
      },
      {
        "table": 5,
        "scope": "Tab 05",
        "row": 1,
        "col": 1,
        "text": "Sheet part"
      },
      {
        "table": 5,
        "scope": "Tab 05",
        "row": 1,
        "col": 2,
        "text": "5"
      },
      {
        "table": 6,
        "scope": "Tab 06",
        "row": 1,
        "col": 1,
        "text": "Sheet part"
      },
      {
        "table": 6,
        "scope": "Tab 06",
        "row": 1,
        "col": 2,
        "text": "6"
      },
      {
        "table": 7,
        "scope": "Tab 07",
        "row": 1,
        "col": 1,
        "text": "Sheet part"
      },
      {
        "table": 7,
        "scope": "Tab 07",
        "row": 1,
        "col": 2,
        "text": "7"
      },
      {
        "table": 8,
        "scope": "Tab 08",
        "row": 1,
        "col": 1,
        "text": "Sheet part"
      },
      {
        "table": 8,
        "scope": "Tab 08",
        "row": 1,
        "col": 2,
        "text": "8"
      },
      {
        "table": 9,
        "scope": "Tab 09",
        "row": 1,
        "col": 1,
        "text": "Sheet part"
      },
      {
        "table": 9,
        "scope": "Tab 09",
        "row": 1,
        "col": 2,
        "text": "9"
      },
      {
        "table": 10,
        "scope": "Tab 10",
        "row": 1,
        "col": 1,
        "text": "Sheet part"
      },
      {
        "table": 10,
        "scope": "Tab 10",
        "row": 1,
        "col": 2,
        "text": "10"
      },
      {
        "table": 11,
        "scope": "Tab 11",
        "row": 1,
        "col": 1,
        "text": "Sheet part"
      },
      {
        "table": 11,
        "scope": "Tab 11",
        "row": 1,
        "col": 2,
        "text": "11"
      }
    ]
  },
  "verification": {
    "method": "Office XML assertions; independent of parser output",
    "oracle": "build_structure_truth.py v2",
    "source_sha256": "5390311748a1153aff009758ded783d6050a923e0e1e7411498b2ddbe153c56d"
  },
  "benchmark_version": "2.0.0"
}
