{
  "file": "xlsx_form_template.xlsx",
  "format": "xlsx",
  "source": "Existing Office regression fixture",
  "features": {
    "text": {
      "paragraph_count": 0,
      "total_words": 0
    }
  },
  "structure_only": true,
  "structure": {
    "containers": [
      {
        "kind": "sheet",
        "name": "Supplier form"
      }
    ],
    "table_cells": [
      {
        "table": 0,
        "scope": "Supplier form",
        "row": 1,
        "col": 1,
        "text": "Supplier onboarding",
        "fill": "#1f4e78",
        "color": "#ffffff",
        "merged": false,
        "col_span": 2
      },
      {
        "table": 0,
        "scope": "Supplier form",
        "row": 2,
        "col": 1,
        "text": "Company name"
      },
      {
        "table": 0,
        "scope": "Supplier form",
        "row": 2,
        "col": 2,
        "text": "",
        "fill": "#ffff00"
      },
      {
        "table": 0,
        "scope": "Supplier form",
        "row": 3,
        "col": 1,
        "text": "VAT number"
      },
      {
        "table": 0,
        "scope": "Supplier form",
        "row": 3,
        "col": 2,
        "text": "",
        "fill": "#ffff00"
      },
      {
        "table": 0,
        "scope": "Supplier form",
        "row": 4,
        "col": 1,
        "text": "Contact email"
      },
      {
        "table": 0,
        "scope": "Supplier form",
        "row": 4,
        "col": 2,
        "text": "",
        "fill": "#ffff00"
      },
      {
        "table": 0,
        "scope": "Supplier form",
        "row": 5,
        "col": 1,
        "text": "Start date"
      },
      {
        "table": 0,
        "scope": "Supplier form",
        "row": 5,
        "col": 2,
        "text": "",
        "fill": "#ffff00"
      },
      {
        "table": 0,
        "scope": "Supplier form",
        "row": 6,
        "col": 1,
        "text": "Approved?"
      },
      {
        "table": 0,
        "scope": "Supplier form",
        "row": 6,
        "col": 2,
        "text": "",
        "fill": "#ffff00"
      },
      {
        "table": 0,
        "scope": "Supplier form",
        "row": 7,
        "col": 1,
        "text": "Office use only"
      },
      {
        "table": 0,
        "scope": "Supplier form",
        "row": 7,
        "col": 2,
        "text": "N/A",
        "fill": "#d9d9d9"
      },
      {
        "table": 0,
        "scope": "Supplier form",
        "row": 1,
        "col": 2,
        "merged": true,
        "text": ""
      }
    ]
  },
  "verification": {
    "method": "Office XML assertions; independent of parser output",
    "oracle": "build_structure_truth.py v2",
    "source_sha256": "ccf106305ab966d78293049b9e4696a272f05489d7e0c1d09ee8b5be21779346"
  },
  "benchmark_version": "2.0.0"
}
