{
  "file": "challenge_comments_multisheet.xlsx",
  "format": "xlsx",
  "source": "Existing Office regression fixture",
  "features": {
    "text": {
      "paragraph_count": 0,
      "total_words": 0
    }
  },
  "structure_only": true,
  "structure": {
    "containers": [
      {
        "kind": "sheet",
        "name": "Plain"
      },
      {
        "kind": "sheet",
        "name": "Reviewed"
      },
      {
        "kind": "sheet",
        "name": "Threads"
      }
    ],
    "table_cells": [
      {
        "table": 0,
        "scope": "Plain",
        "row": 1,
        "col": 1,
        "text": "Item"
      },
      {
        "table": 0,
        "scope": "Plain",
        "row": 1,
        "col": 2,
        "text": "Owner"
      },
      {
        "table": 0,
        "scope": "Plain",
        "row": 2,
        "col": 1,
        "text": "Kickoff"
      },
      {
        "table": 0,
        "scope": "Plain",
        "row": 2,
        "col": 2,
        "text": "Ann"
      },
      {
        "table": 1,
        "scope": "Reviewed",
        "row": 1,
        "col": 1,
        "text": "Budget"
      },
      {
        "table": 1,
        "scope": "Reviewed",
        "row": 1,
        "col": 2,
        "text": "1200"
      },
      {
        "table": 1,
        "scope": "Reviewed",
        "row": 2,
        "col": 1,
        "text": "Spent"
      },
      {
        "table": 1,
        "scope": "Reviewed",
        "row": 2,
        "col": 2,
        "text": "800"
      },
      {
        "table": 2,
        "scope": "Threads",
        "row": 1,
        "col": 1,
        "text": "Quarter"
      },
      {
        "table": 2,
        "scope": "Threads",
        "row": 1,
        "col": 2,
        "text": "Region"
      },
      {
        "table": 2,
        "scope": "Threads",
        "row": 1,
        "col": 3,
        "text": "Forecast"
      },
      {
        "table": 2,
        "scope": "Threads",
        "row": 2,
        "col": 1,
        "text": "Q1"
      },
      {
        "table": 2,
        "scope": "Threads",
        "row": 2,
        "col": 2,
        "text": "EMEA"
      },
      {
        "table": 2,
        "scope": "Threads",
        "row": 2,
        "col": 3,
        "text": "Q1 forecast"
      },
      {
        "table": 2,
        "scope": "Threads",
        "row": 3,
        "col": 1,
        "text": "Q2"
      },
      {
        "table": 2,
        "scope": "Threads",
        "row": 3,
        "col": 2,
        "text": "EMEA"
      },
      {
        "table": 2,
        "scope": "Threads",
        "row": 3,
        "col": 3,
        "text": "Q2 forecast"
      },
      {
        "table": 2,
        "scope": "Threads",
        "row": 4,
        "col": 1,
        "text": "Q3"
      },
      {
        "table": 2,
        "scope": "Threads",
        "row": 4,
        "col": 2,
        "text": "EMEA"
      },
      {
        "table": 2,
        "scope": "Threads",
        "row": 4,
        "col": 3,
        "text": "Q3 forecast"
      }
    ],
    "comment_anchors": [
      {
        "text": "Check this figure",
        "author": "Ann",
        "annotated_text": "B1: 1200",
        "anchored": true,
        "scope": "Reviewed"
      },
      {
        "text": "Is this final?",
        "author": "Priya",
        "annotated_text": "C4: Q3 forecast",
        "anchored": true,
        "scope": "Threads"
      }
    ]
  },
  "verification": {
    "method": "Office XML assertions; independent of parser output",
    "oracle": "build_structure_truth.py v2",
    "source_sha256": "a640e476a04ca0c8b174ebc732febacbad1031b231c22352a994c13fbd4786f0"
  },
  "benchmark_version": "2.0.0"
}
